{
  "stage": "ambiguity",
  "stage_status": "complete",
  "open_questions": [
    {
      "id": "OQ-1",
      "severity": "P1",
      "question": "Which Legal-approved neutral message must be used for pending wire status?",
      "why_matters": "Customer-facing wording can create tipping-off risk if it reveals AML or sanctions rationale.",
      "suggested_resolver": "Legal",
      "related_story_ids": ["EPIC-WIRE-STATUS-1"],
      "provenance": "hidden_frame_sweep",
      "frame": 4
    }
  ],
  "assumptions_made": [
    {
      "assumption": "Customer status copy will remain neutral until Legal approves final text.",
      "why_made": "A safe placeholder allows story drafting while preserving the Legal gate.",
      "related_story_ids": ["EPIC-WIRE-STATUS-1"],
      "provenance": "hidden_frame_sweep",
      "frame": 10,
      "default_revisit_trigger": "Legal sign-off meeting"
    }
  ],
  "ambiguity_findings": [
    {
      "detector": "modal",
      "severity": "P2",
      "evidence": "should use generic message",
      "source_ref": "JIRA-321 AC-1",
      "resolution_path": "Convert to MUST after Legal confirms language.",
      "related_question_id": "OQ-1"
    }
  ],
  "processing_metadata": {
    "hidden_requirements_sweep": {
      "frames_applied": [1, 2, 4, 5, 6, 9, 10],
      "frames_skipped": [3, 7, 8],
      "frames_skipped_reasons": {
        "3": "No pricing, settlement amount, fee, or cost model in source.",
        "7": "No external API, vendor, batch, or file dependency named.",
        "8": "No named market, language, currency, timezone, or holiday constraint."
      },
      "findings_per_frame": {
        "1": 1,
        "2": 1,
        "4": 1,
        "5": 1,
        "6": 1,
        "9": 1,
        "10": 1
      },
      "deferred_findings_count": 0,
      "total_findings": 7,
      "coverage_score": "complete"
    }
  }
}
